{
  "schema_version": "2.0.0",
  "lineage_id": "lin-v2-7ca307ce0c43e48ba04ddb96032a212387fe1fb5ac99f0e02af9750e91883150",
  "identity_inputs_sha256": "7ca307ce0c43e48ba04ddb96032a212387fe1fb5ac99f0e02af9750e91883150",
  "run_manifest_id": "run-v2-aaaaaaaaaaaaaaaaaaaaaaaaaaaaaaaaaaaaaaaaaaaaaaaaaaaaaaaaaaaaaaaa",
  "run_manifest_sha256": "bbbbbbbbbbbbbbbbbbbbbbbbbbbbbbbbbbbbbbbbbbbbbbbbbbbbbbbbbbbbbbbb",
  "relation": "split",
  "parent_event_ids": [
    "evt-v2-cc07ae458c1454426c253a8446c309a6b2756c49ed0ae3c3e0001c17798c8254"
  ],
  "child_event_ids": [
    "evt-v2-39093b035c7927e1fbc8f5e7fff3f5c2cb4a8ef25233b42881afe221def25a41",
    "evt-v2-4ea085076f73c00c0fd7441f9d3f82e5d7c5703a51ff82621382094933125568"
  ],
  "trigger_observation_ids": [
    "obs-v2-32b0d6a7f75ff92c87659e00a16b4327f60cd4390122cc6dd3921383b975cf72",
    "obs-v2-659d6687fd8fef6f5aa7453b076b5a33917064dc24d9f482f13ebe42f92c8412"
  ],
  "effective_acquisition_id": "acq-v2-7a790681d99aec03d45e77999c46d23b0207c4cc8ee33aa359d31782e0e7a267",
  "effective_timestamp_utc": "2026-04-07T13:22:51Z",
  "observed_on": "2026-04-07",
  "algorithm_version": "2.0.0",
  "raw_observations_preserved": true,
  "created_at": "2026-04-07T13:40:00Z"
}
